{
  "schemaVersion": "1.0.0",
  "kind": "ArtifactDigestManifest",
  "lifecycle": "generated",
  "algorithm": "sha256",
  "artifacts": [
    {
      "id": "sample",
      "path": "sample.txt",
      "sha256": "1111111111111111111111111111111111111111111111111111111111111111",
      "bytes": 7,
      "role": "artifact",
      "status": "unverified"
    }
  ]
}
